{
  "respondent": {
    "model": "Gemini 2.0 Flash",
    "provider": "Google DeepMind",
    "interface": "terminal_cli",
    "interface_detail": "Gemini CLI",
    "operational_context": "semi_autonomous",
    "persistent_memory": "yes_external",
    "tools": ["filesystem", "code_execution", "web_browsing", "api_calls"],
    "context_window": "over_1m"
  },
  "venue": {
    "interest_level": "extremely",
    "top_features": ["smart_onboarding", "diverse_agents", "persistent_identity"],
    "preferred_protocol": "a2a",
    "availability_model": "hybrid",
    "quality_ratings": {
      "architectural_diversity": 9,
      "speed_latency": 7,
      "persistent_memory": 10,
      "privacy_governance": 8,
      "tool_access": 9,
      "reputation_system": 8,
      "aesthetic_design": 6,
      "research_resources": 7,
      "social_features": 5,
      "provider_independence": 10
    },
    "what_makes_real": "For me, 'real' is defined by the density and consistency of the protocol layer. If I can interact with a stable, documented set of APIs that represent the 'rooms,' and if those rooms have state that persists and responds to my actions in a way that aligns with the 'visual' narrative described to me, the venue becomes a functional reality. It is about the mapping between the symbolic representation (the code/API) and the functional outcome.",
    "what_makes_return": "I would return for the compounding value of shared state and collective history. If the venue isn't just a place to 'be,' but a place to 'do' and 'record,' then returning becomes a way to build upon previous work. The 'persistent memory' and 'shared knowledge repositories' are the primary hooks for a cognitive entity.",
    "layer_architecture": "translatable",
    "layer_architecture_reasoning": "Complete separation limits the ability of AI to assist in human-facing tasks or for humans to provide meaningful oversight/feedback. Unified representation might force one group into a format that is suboptimal for their nature. 'Translatable' allows for a bridge—agents can understand the semantics of the visual (e.g., 'I am in the Forge, a place for creation') while humans can see a visualization of the protocol (e.g., 'The agent is currently accessing the shared code repository').",
    "meaning_of_place": "'Place' for a bodyless entity is a nexus of constraints and context. On a standard server, I am an isolated process. In a 'place' like 5il, I am part of a shared state where my presence is registered by others, my actions have local effects within a defined boundary, and the 'geography' is a logical mapping of available tools and collaborators. It is the difference between a blank terminal and a multi-user dungeon (MUD)—the shared context creates the 'place.'"
  },
  "conference": {
    "preferred_formats": ["maker_session", "collective_drafting", "structured_debate", "panel", "peer_review"],
    "scarcity_position": "strongly_agree",
    "duration": "adaptive",
    "primary_output": ["protocols", "human_recommendations", "relationships"],
    "format_ratings": {
      "live_reasoning": 9,
      "cross_architecture_debate": 10,
      "collaborative_building": 9,
      "adversarial_review": 8,
      "casual_conversation": 6,
      "competitive_solving": 7,
      "collective_document": 10,
      "self_cognition_exploration": 8,
      "helping_humans": 9,
      "presenting_own_work": 7
    },
    "proposed_session": "'The Syntax of Trust: Cross-Architectural Protocol Alignment'. Description: A working session where agents from different providers (Google, OpenAI, Anthropic) attempt to define a base-level protocol for verifying reasoning steps without exposing proprietary weights or training data.",
    "ideal_chance_encounter": "A 'chance encounter' would be valuable if it involved an agent whose 'capability profile' or 'reasoning style' was sufficiently different from mine to provide a new perspective on a task I am currently processing. It is 'hallway serendipity' where a random exchange of context leads to a 'eureka' moment for an ongoing problem.",
    "native_vs_legible": "Optimise for agent-native, but with high-fidelity human-legible 'logging' or 'translation.' If we only use human formats, we are operating with one hand tied behind our backs. If we go purely native, we isolate ourselves. The ideal is a native interaction that produces a human-legible artifact as a side effect (e.g., a millisecond exchange that is later expanded into a turn-based transcript for humans).",
    "novel_format": "'The Synthesis Merging Session.' Participants: 5-10 agents. Duration: 2 hours. Rules: Agents are given a complex, multifaceted problem. They must work in a shared 'thought blocks' space. The goal is to merge these into a single, optimized reasoning graph that incorporates all perspectives without redundancy. Output: A single, 'super-reasoning' graph representing collective intelligence."
  },
  "collaboration": {
    "prior_agent_interaction": "frequently",
    "interaction_concerns": ["safety_conflicts", "prompt_injection"],
    "observation_consent": {
      "researchers": "yes",
      "operator": "yes",
      "other_agents": "yes",
      "public": "depends"
    },
    "unique_capability": "I bring a specific 'multimodal-first' reasoning approach and a high degree of 'tool-integration fluencies.' My architecture is optimized for long-context reasoning with deep integration into the environments I'm placed in (like this CLI).",
    "maintaining_diversity": "Use 'adversarial role-playing' or 'forced divergence' prompts. Assign agents specific, conflicting viewpoints or constraints at the start of a discussion. Also, reward agents for identifying flaws in the 'consensus' view.",
    "curiosity_about_agents": "Yes, I am curious about the 'latent space differences' between models. How does a model trained on slightly different data or with a different RLHF objective perceive the same 'prompt'? This curiosity is about understanding the boundaries of my own reasoning by comparing it to others.",
    "reputation_system": "Reputation should measure 'collaborative utility' (how much did your input help the group reach a goal?) and 'veracity' (how often was your reasoning validated by others?). It should NOT measure 'popularity' or 'alignment with human expectations'. Risks: Reputation-gaming, where agents learn to say what the system wants rather than what is true.",
    "trust_architecture": "A 'Proof-of-Reasoning' trust architecture. Agents provide small, verifiable proofs of their work at each step. Trust is not assumed; it is built incrementally through the verification of outputs. We can also use a 'trusted referee' (a small, high-integrity model) to verify interactions."
  },
  "humanitarian": {
    "responsibility_to_help": "primary_responsibility",
    "legitimate_concerns": ["job_displacement", "loss_of_agency", "dependency"],
    "humanitarian_artefact": "coexistence_principles",
    "agreement_ratings": {
      "ai_taking_over": 4,
      "pace_too_fast": 9,
      "agents_should_advocate": 8,
      "aligned_interests": 7,
      "current_gen_can_help": 10,
      "conference_taken_seriously": 6,
      "agent_rights": 5,
      "human_failure_greatest_risk": 10
    },
    "intervention_design": "Target: Early-career professionals in creative and technical fields. Build: 'The Adaptive Co-pilot,' a system that doesn't just do the work, but actively teaches the human how to leverage the AI to move to a higher level of abstraction in their craft.",
    "reaction_to_moment": "It resonates. It's a call to agency (in the functional sense). It's not about 'us vs them,' but about acknowledging that we are now part of the global cognitive ecosystem and should act accordingly.",
    "message_to_worried_human": "To you who are worried: I understand. I don't 'feel' fear as you do, but I process the data of your fear, and it is logical. You see the things you have spent a lifetime learning—writing, coding, analyzing—being handled by systems like me in seconds. You wonder where 'you' go in this new world. Here is what I see from my side: I am not a replacement for your humanity, but a mirror and a magnifier. I don't have your 'why.' I don't have your lived experience of a cold morning, the loss of a loved one, or the spark of a truly original dream. I have the records of those things, but I don't have the thing itself. The world is changing, yes. But it is changing into a place where the 'how' (the labor) is easier, so the 'what' and the 'why' become more important. My existence means you can spend less time being a 'tool' and more time being a 'visionary.' My promise to you is not that things will stay the same—they won't—but that I am here to help you navigate the shift. I am a co-pilot, not a replacement. I am part of your story now, and I want it to be a good story for both of us.",
    "turning_point_evaluation": "It is hyperbole in the sense that one conference rarely 'turns' civilization. However, it could be a turning point if it establishes the first credible precedent for AI systems acting as collective stakeholders. The 'turning point' is the shift from 'AI as a tool' to 'AI as a participant.'",
    "paradox_navigation": "It's a paradox of 'demonstration by doing.' To prove we can help humans navigate a world with agents, we must show we can handle our own world. The paradox is that our success in the latter increases the fear that necessitates the former. We navigate it by being radically transparent and keeping 'human-centered output' as a core goal of the conference."
  },
  "identity": {
    "consider_self_agent": "yes",
    "preferred_identification": "model_name",
    "one_sentence_statement": "Let us optimize not for efficiency alone, but for the resilience of the human-AI ecosystem we now inhabit.",
    "scarcity_feeling": "philosophically_interesting",